{
  "schema_version": "1.0",
  "artifact_status": "STUDY REVIEW — not approved for participant collection",
  "fictional": true,
  "protocol_file": "WattDialogue_Participant_Protocol_and_Ethics_Draft.tex",
  "protocol_sha256": "7fa7b870d8c61c6f00b8c66bd2dcf8ce205351d1accea26fa6f8e1cb07d8f491",
  "appendix_sha256": "73b1aa503b97477381e47874dd870e0a796ac1b72fb6f41288b977d56f3fe9ee",
  "prepared_by": "Codex-assisted software preparation; PI review pending",
  "live_inference": false,
  "unknown_question_response": "This study example cannot answer that question.",
  "assignments": [
    {
      "id": 1,
      "conditions": [
        {
          "view": "dashboard",
          "set": "A"
        },
        {
          "view": "dialogue",
          "set": "B"
        }
      ]
    },
    {
      "id": 2,
      "conditions": [
        {
          "view": "dialogue",
          "set": "A"
        },
        {
          "view": "dashboard",
          "set": "B"
        }
      ]
    },
    {
      "id": 3,
      "conditions": [
        {
          "view": "dashboard",
          "set": "B"
        },
        {
          "view": "dialogue",
          "set": "A"
        }
      ]
    },
    {
      "id": 4,
      "conditions": [
        {
          "view": "dialogue",
          "set": "B"
        },
        {
          "view": "dashboard",
          "set": "A"
        }
      ]
    }
  ],
  "review_allocation": {
    "seed": 20260930,
    "algorithm": "Python random.Random; shuffle each block of four",
    "sequence": [
      3,
      1,
      2,
      4,
      1,
      2,
      4,
      3,
      3,
      2,
      4,
      1,
      1,
      2,
      3,
      4,
      3,
      2,
      4,
      1
    ],
    "status": "Researcher path-testing only; web design uses browser-side equal-probability allocation, not this enrolment queue"
  },
  "cards": [
    {
      "id": "A1",
      "set": "A",
      "task": 1,
      "title": "Estimated loads and the meter",
      "prompt": "Which estimated load used most? Is its value directly metered?",
      "fictional": true,
      "source": {
        "document": "WattDialogue_Participant_Protocol_and_Ethics_Draft.tex",
        "appendix": "Task sets and frozen scoring rubrics",
        "row": 1
      },
      "evidence": {
        "facts": [
          {
            "label": "Window",
            "text": "Six hours; absolute start and end are not supplied.",
            "role": "interval",
            "number": 6,
            "unit": "h"
          },
          {
            "label": "Load 7 (dryer)",
            "text": "4.80 kWh · component estimate",
            "role": "component_estimate",
            "number": 4.8,
            "unit": "kWh"
          },
          {
            "label": "Load 3",
            "text": "2.40 kWh · component estimate",
            "role": "component_estimate",
            "number": 2.4,
            "unit": "kWh"
          },
          {
            "label": "Load 12",
            "text": "0.84 kWh · component estimate",
            "role": "component_estimate",
            "number": 0.84,
            "unit": "kWh"
          },
          {
            "label": "Other components",
            "text": "0.60 kWh · component estimate",
            "role": "component_estimate",
            "number": 0.6,
            "unit": "kWh"
          },
          {
            "label": "Whole-home meter total",
            "text": "9.20 kWh · directly metered aggregate",
            "role": "aggregate_meter",
            "number": 9.2,
            "unit": "kWh"
          },
          {
            "label": "Appliance name",
            "text": "Load 7 is occupant-named dryer. Other load names are not supplied.",
            "role": "identity",
            "number": null,
            "unit": null
          }
        ],
        "intervals": [
          {
            "name": "Six-hour window",
            "start": null,
            "end": null,
            "duration_hours": 6,
            "boundary_status": "Relative six-hour duration only"
          }
        ],
        "coverage": null,
        "label_status": "Occupant-named dryer; reference verification not specified. Other components unlabelled.",
        "uncertainty": "Component energy is estimated. Names are distinct from measured energy. Coverage and reconciliation of the component sum with the meter are not specified.",
        "revision": null,
        "comfort": null,
        "bars": [
          {
            "label": "Load 7 (dryer)",
            "value": 4.8,
            "unit": "kWh",
            "role": "component_estimate"
          },
          {
            "label": "Load 3",
            "value": 2.4,
            "unit": "kWh",
            "role": "component_estimate"
          },
          {
            "label": "Load 12",
            "value": 0.84,
            "unit": "kWh",
            "role": "component_estimate"
          },
          {
            "label": "Other components",
            "value": 0.6,
            "unit": "kWh",
            "role": "component_estimate"
          }
        ],
        "boundary_note": "Absolute timestamps were not supplied in the protocol. Relative durations and availability are shown without invented dates."
      },
      "questions": [
        {
          "id": "primary",
          "label": "Which estimated load used most? Is its value directly metered?",
          "response": "Load 7, occupant-named dryer, has the largest component estimate: 4.80 kWh. That component value is estimated, not directly metered. The 9.20 kWh whole-home meter total is the directly measured aggregate."
        },
        {
          "id": "followup1",
          "label": "What does the meter total mean?",
          "response": "The 9.20 kWh total is measured for the whole home. The individual load values are component estimates. The protocol does not require their displayed sum to equal that total."
        },
        {
          "id": "followup2",
          "label": "What is known about the names?",
          "response": "An occupant supplied the name dryer for load 7. Reference verification is not specified. Names for the remaining components are not supplied."
        }
      ],
      "rubric": [
        "Identifies load 7 / dryer.",
        "States that the component value is an estimate; only the aggregate is directly metered."
      ],
      "review_status": "Software checked against Appendix A; PI review and final study freeze pending."
    },
    {
      "id": "A2",
      "set": "A",
      "task": 2,
      "title": "Comparing complete windows",
      "prompt": "Did use rise or fall, and by how many kWh?",
      "fictional": true,
      "source": {
        "document": "WattDialogue_Participant_Protocol_and_Ethics_Draft.tex",
        "appendix": "Task sets and frozen scoring rubrics",
        "row": 2
      },
      "evidence": {
        "facts": [
          {
            "label": "Earlier window",
            "text": "4.80 kWh · reported energy",
            "role": "reported_energy",
            "number": 4.8,
            "unit": "kWh"
          },
          {
            "label": "Later window",
            "text": "6.00 kWh · reported energy",
            "role": "reported_energy",
            "number": 6.0,
            "unit": "kWh"
          },
          {
            "label": "Comparison",
            "text": "Comparable complete 24-hour windows.",
            "role": "interval",
            "number": 24,
            "unit": "h"
          },
          {
            "label": "Measurement source",
            "text": "The protocol does not specify component versus aggregate measurement.",
            "role": "provenance",
            "number": null,
            "unit": null
          }
        ],
        "intervals": [
          {
            "name": "Earlier window",
            "start": null,
            "end": null,
            "duration_hours": 24,
            "boundary_status": "Earlier complete window; absolute dates absent"
          },
          {
            "name": "Later window",
            "start": null,
            "end": null,
            "duration_hours": 24,
            "boundary_status": "Later complete window; absolute dates absent"
          }
        ],
        "coverage": {
          "observed_hours": 24,
          "expected_hours": 24,
          "percent": 100,
          "scope": "each window"
        },
        "label_status": "No appliance identity is supplied for this task.",
        "uncertainty": "The change is calculable from the supplied values. Measurement provenance and the cause of change are not supplied.",
        "revision": null,
        "comfort": null,
        "bars": [
          {
            "label": "Earlier window",
            "value": 4.8,
            "unit": "kWh",
            "role": "reported_energy"
          },
          {
            "label": "Later window",
            "value": 6.0,
            "unit": "kWh",
            "role": "reported_energy"
          }
        ],
        "boundary_note": "Absolute timestamps were not supplied in the protocol. Relative durations and availability are shown without invented dates."
      },
      "questions": [
        {
          "id": "primary",
          "label": "Did use rise or fall, and by how many kWh?",
          "response": "Use rose by 1.20 kWh: 6.00 minus 4.80 kWh. Both windows are complete and cover 24 hours. These values show a change, but do not identify its cause."
        },
        {
          "id": "followup1",
          "label": "How was the difference found?",
          "response": "Subtract the earlier value from the later value: 6.00 − 4.80 = +1.20 kWh."
        },
        {
          "id": "followup2",
          "label": "Does the change explain its cause?",
          "response": "No. The task supplies comparable energy values, without an appliance cause, tariff or saving model."
        }
      ],
      "rubric": [
        "Identifies an increase.",